<?xml version="1.0" encoding="UTF-8" ?>
<!DOCTYPE sqlMapConfig
    PUBLIC "-//iBATIS.com//DTD SQL Map Config 2.0//EN"
    "http://www.ibatis.com/dtd/sql-map-config-2.dtd">

<sqlMapConfig>

  <properties resource="com/ibatis/sqlmap/maps/SqlMapConfig.properties"/>

  <!-- settings
	add these to test bug 976614
	enhancementEnabled="false"
    lazyLoadingEnabled="false"
  -->

  <settings
    cacheModelsEnabled="true"
    enhancementEnabled="true"
    lazyLoadingEnabled="true"
    errorTracingEnabled="false"
    maxRequests="32"
    maxSessions="10"
    maxTransactions="5"
    useStatementNamespaces="false"
    />

  <typeAlias alias="order" type="testdomain.Order"/>
  <typeAlias alias="OuiNonBool" type="com.ibatis.sqlmap.extensions.OuiNonTypeHandlerCallback"/>

  <typeHandler javaType="boolean" jdbcType="VARCHAR" callback="OuiNonBool" />

  <transactionManager type="JDBC">
    <dataSource type="SIMPLE">
      <property name="JDBC.Driver" value="${driver}"/>
      <property name="JDBC.ConnectionURL" value="${url}"/>
      <property name="JDBC.Username" value="${username}"/>
      <property name="JDBC.Password" value="${password}"/>
      <property name="JDBC.DefaultAutoCommit" value="true"/>
      <property name="Pool.MaximumActiveConnections" value="10"/>
      <property name="Pool.MaximumIdleConnections" value="5"/>
      <property name="Pool.MaximumCheckoutTime" value="120000"/>
      <property name="Pool.TimeToWait" value="500"/>
      <property name="Pool.PingQuery" value="select 1 from ACCOUNT"/>
      <property name="Pool.PingEnabled" value="false"/>
      <property name="Pool.PingConnectionsOlderThan" value="1"/>
      <property name="Pool.PingConnectionsNotUsedFor" value="1"/>
      <property name="Pool.QuietMode" value="true"/>
    </dataSource>
  </transactionManager>

  <sqlMap resource="com/ibatis/sqlmap/maps/Account.xml"/>
  <sqlMap resource="com/ibatis/sqlmap/maps/DynamicAccount.xml"/>
  <sqlMap resource="com/ibatis/sqlmap/maps/Order.xml"/>
  <sqlMap resource="com/ibatis/sqlmap/maps/LineItem.xml"/>
  <sqlMap resource="com/ibatis/sqlmap/maps/OracleProc.xml"/>
  <sqlMap resource="com/ibatis/sqlmap/maps/Complex.xml"/>
  <sqlMap resource="com/ibatis/sqlmap/maps/XmlStatements.xml"/>
  <sqlMap resource="com/ibatis/sqlmap/maps/DomStatements.xml"/>

</sqlMapConfig>
