<?xml version="1.0" encoding="UTF-8"?>
<!DOCTYPE sqlMapConfig
  PUBLIC "-//ibatis.apache.org//DTD SQL Map Config 2.0//EN"
  "http://ibatis.apache.org/dtd/sql-map-config-2.dtd">

<sqlMapConfig>

  <settings useStatementNamespaces="true" />

  <sqlMap resource="ibatortest/generated/conditional/java2/xml/FIELDSBLOBS_SqlMap.xml" />
  <sqlMap resource="ibatortest/generated/conditional/java2/xml/FIELDSONLY_SqlMap.xml" />
  <sqlMap resource="ibatortest/generated/conditional/java2/xml/PKBLOBS_SqlMap.xml" />
  <sqlMap resource="ibatortest/generated/conditional/java2/xml/PKFIELDS_SqlMap.xml" />
  <sqlMap resource="ibatortest/generated/conditional/java2/xml/PKFIELDSBLOBS_SqlMap.xml" />
  <sqlMap resource="ibatortest/generated/conditional/java2/xml/PKONLY_SqlMap.xml" />
  <sqlMap resource="ibatortest/generated/conditional/java2/xml/awful table_SqlMap.xml" />

</sqlMapConfig>
